title,company,location,salary,skills,description
Frontend Developer Intern,Razorpay,"Bangalore, India",₹25,000/month,React TypeScript CSS,Build beautiful responsive web applications using React.
Data Science Intern,Flipkart,"Bangalore, India",₹20,000/month,Python ML Pandas,Build models to analyze customer behavior and purchase patterns.
Product Management Intern,Swiggy,"Hyderabad, India",₹18,000/month,Analytics Figma SQL,Collaborate with engineering to define and ship features.
Backend Developer Intern,Zepto,"Mumbai, India",₹22,000/month,Node.js MongoDB REST APIs,Maintain server logic and scale database endpoints.
UI/UX Design Intern,Meesho,"Bangalore, India",₹15,000/month,Figma Prototyping User Research,Create gorgeous UI templates and design user-centered layouts.
DevOps Intern,Ola,"Bangalore, India",₹20,000/month,Docker AWS CI/CD,Automate build pipelines and deploy containerized services.
